{
  "handoff_id": "LPR-HO-SYN-002",
  "case_id": "LPR-CASE-SYN-001",
  "partner_id": "LPR-P-SYN-001",
  "partner_status": "PILOT",
  "stage": "ACKNOWLEDGED",
  "purpose": "Record the fictional licensed partner acknowledging the synthetic introduction and taking ownership of the consultation step.",
  "consent": {
    "consent_id": "LPR-CONS-SYN-001",
    "status": "GRANTED",
    "evidence_ref": "synthetic://consent/LPR-CONS-SYN-001"
  },
  "minimum_data_fields": [
    "preferred_name",
    "email",
    "current_country",
    "language",
    "destination",
    "purchase_purpose",
    "budget_range",
    "timing",
    "service_needs"
  ],
  "lotus_owner": "Synthetic Lotus Coordinator",
  "partner_owner": "Synthetic Licensed Partner Manager",
  "introduced_at": "2026-07-21T08:10:00Z",
  "acknowledged_at": "2026-07-21T08:25:00Z",
  "handoff_evidence_ref": "synthetic://handoff/LPR-HO-SYN-002",
  "next_action": {
    "owner": "Synthetic Licensed Partner Manager",
    "action": "Offer the synthetic client two consultation times through the consented channel.",
    "due_at": "2026-07-22T08:25:00Z"
  },
  "risk_flags": ["NONE"]
}
